
 /----------------------------------------------------------------------------\
 |                                                                            |
 |  yosys -- Yosys Open SYnthesis Suite                                       |
 |                                                                            |
 |  Copyright (C) 2012 - 2020  Claire Xenia Wolf <claire@yosyshq.com>         |
 |                                                                            |
 |  Permission to use, copy, modify, and/or distribute this software for any  |
 |  purpose with or without fee is hereby granted, provided that the above    |
 |  copyright notice and this permission notice appear in all copies.         |
 |                                                                            |
 |  THE SOFTWARE IS PROVIDED "AS IS" AND THE AUTHOR DISCLAIMS ALL WARRANTIES  |
 |  WITH REGARD TO THIS SOFTWARE INCLUDING ALL IMPLIED WARRANTIES OF          |
 |  MERCHANTABILITY AND FITNESS. IN NO EVENT SHALL THE AUTHOR BE LIABLE FOR   |
 |  ANY SPECIAL, DIRECT, INDIRECT, OR CONSEQUENTIAL DAMAGES OR ANY DAMAGES    |
 |  WHATSOEVER RESULTING FROM LOSS OF USE, DATA OR PROFITS, WHETHER IN AN     |
 |  ACTION OF CONTRACT, NEGLIGENCE OR OTHER TORTIOUS ACTION, ARISING OUT OF   |
 |  OR IN CONNECTION WITH THE USE OR PERFORMANCE OF THIS SOFTWARE.            |
 |                                                                            |
 \----------------------------------------------------------------------------/

 Yosys 0.33 (git sha1 2584903a060)


-- Executing script file `synth.ys' --

1. Executing Verilog-2005 frontend: ../rtl/aes_core.v
Parsing Verilog input from `../rtl/aes_core.v' to AST representation.
Generating RTLIL representation for module `\aes_core'.
Successfully finished Verilog frontend.

2. Executing Verilog-2005 frontend: ../rtl/top.v
Parsing Verilog input from `../rtl/top.v' to AST representation.
Generating RTLIL representation for module `\top'.
Successfully finished Verilog frontend.

3. Executing SYNTH pass.

3.1. Executing HIERARCHY pass (managing design hierarchy).

3.1.1. Analyzing design hierarchy..
Top module:  \top
Used module:     \aes_core

3.1.2. Analyzing design hierarchy..
Top module:  \top
Used module:     \aes_core
Removed 0 unused modules.

3.2. Executing PROC pass (convert processes to netlists).

3.2.1. Executing PROC_CLEAN pass (remove empty switches from decision trees).
Cleaned up 0 empty switches.

3.2.2. Executing PROC_RMDEAD pass (remove dead branches from decision trees).
Marked 2 switch rules as full_case in process $proc$../rtl/aes_core.v:14$1 in module aes_core.
Removed a total of 0 dead cases.

3.2.3. Executing PROC_PRUNE pass (remove redundant assignments in processes).
Removed 1 redundant assignment.
Promoted 0 assignments to connections.

3.2.4. Executing PROC_INIT pass (extract init attributes).

3.2.5. Executing PROC_ARST pass (detect async resets in processes).
Found async reset \rst in `\aes_core.$proc$../rtl/aes_core.v:14$1'.

3.2.6. Executing PROC_ROM pass (convert switches to ROMs).
Converted 0 switches.
<suppressed ~1 debug messages>

3.2.7. Executing PROC_MUX pass (convert decision trees to multiplexers).
Creating decoders for process `\aes_core.$proc$../rtl/aes_core.v:14$1'.
     1/2: $0\done[0:0]
     2/2: $0\ciphertext[127:0]

3.2.8. Executing PROC_DLATCH pass (convert process syncs to latches).

3.2.9. Executing PROC_DFF pass (convert process syncs to FFs).
Creating register for signal `\aes_core.\ciphertext' using process `\aes_core.$proc$../rtl/aes_core.v:14$1'.
  created $adff cell `$procdff$9' with positive edge clock and positive level reset.
Creating register for signal `\aes_core.\done' using process `\aes_core.$proc$../rtl/aes_core.v:14$1'.
  created $adff cell `$procdff$10' with positive edge clock and positive level reset.

3.2.10. Executing PROC_MEMWR pass (convert process memory writes to cells).

3.2.11. Executing PROC_CLEAN pass (remove empty switches from decision trees).
Found and cleaned up 1 empty switch in `\aes_core.$proc$../rtl/aes_core.v:14$1'.
Removing empty process `aes_core.$proc$../rtl/aes_core.v:14$1'.
Cleaned up 1 empty switch.

3.2.12. Executing OPT_EXPR pass (perform const folding).
Optimizing module top.
Optimizing module aes_core.

3.3. Executing OPT_EXPR pass (perform const folding).
Optimizing module top.
Optimizing module aes_core.

3.4. Executing OPT_CLEAN pass (remove unused cells and wires).
Finding unused cells or wires in module \top..
Finding unused cells or wires in module \aes_core..
Removed 0 unused cells and 4 unused wires.
<suppressed ~1 debug messages>

3.5. Executing CHECK pass (checking for obvious problems).
Checking module aes_core...
Checking module top...
Found and reported 0 problems.

3.6. Executing OPT pass (performing simple optimizations).

3.6.1. Executing OPT_EXPR pass (perform const folding).
Optimizing module aes_core.
Optimizing module top.

3.6.2. Executing OPT_MERGE pass (detect identical cells).
Finding identical cells in module `\aes_core'.
Finding identical cells in module `\top'.
Removed a total of 0 cells.

3.6.3. Executing OPT_MUXTREE pass (detect dead branches in mux trees).
Running muxtree optimizer on module \aes_core..
  Creating internal representation of mux trees.
  Evaluating internal representation of mux trees.
  Analyzing evaluation results.
Running muxtree optimizer on module \top..
  Creating internal representation of mux trees.
  No muxes found in this module.
Removed 0 multiplexer ports.
<suppressed ~2 debug messages>

3.6.4. Executing OPT_REDUCE pass (consolidate $*mux and $reduce_* inputs).
  Optimizing cells in module \aes_core.
  Optimizing cells in module \top.
Performed a total of 0 changes.

3.6.5. Executing OPT_MERGE pass (detect identical cells).
Finding identical cells in module `\aes_core'.
Finding identical cells in module `\top'.
Removed a total of 0 cells.

3.6.6. Executing OPT_DFF pass (perform DFF optimizations).

3.6.7. Executing OPT_CLEAN pass (remove unused cells and wires).
Finding unused cells or wires in module \aes_core..
Finding unused cells or wires in module \top..

3.6.8. Executing OPT_EXPR pass (perform const folding).
Optimizing module aes_core.
Optimizing module top.

3.6.9. Finished OPT passes. (There is nothing left to do.)

3.7. Executing FSM pass (extract and optimize FSM).

3.7.1. Executing FSM_DETECT pass (finding FSMs in design).

3.7.2. Executing FSM_EXTRACT pass (extracting FSM from design).

3.7.3. Executing FSM_OPT pass (simple optimizations of FSMs).

3.7.4. Executing OPT_CLEAN pass (remove unused cells and wires).
Finding unused cells or wires in module \aes_core..
Finding unused cells or wires in module \top..

3.7.5. Executing FSM_OPT pass (simple optimizations of FSMs).

3.7.6. Executing FSM_RECODE pass (re-assigning FSM state encoding).

3.7.7. Executing FSM_INFO pass (dumping all available information on FSM cells).

3.7.8. Executing FSM_MAP pass (mapping FSMs to basic logic).

3.8. Executing OPT pass (performing simple optimizations).

3.8.1. Executing OPT_EXPR pass (perform const folding).
Optimizing module aes_core.
Optimizing module top.

3.8.2. Executing OPT_MERGE pass (detect identical cells).
Finding identical cells in module `\aes_core'.
Finding identical cells in module `\top'.
Removed a total of 0 cells.

3.8.3. Executing OPT_MUXTREE pass (detect dead branches in mux trees).
Running muxtree optimizer on module \aes_core..
  Creating internal representation of mux trees.
  Evaluating internal representation of mux trees.
  Analyzing evaluation results.
Running muxtree optimizer on module \top..
  Creating internal representation of mux trees.
  No muxes found in this module.
Removed 0 multiplexer ports.
<suppressed ~2 debug messages>

3.8.4. Executing OPT_REDUCE pass (consolidate $*mux and $reduce_* inputs).
  Optimizing cells in module \aes_core.
  Optimizing cells in module \top.
Performed a total of 0 changes.

3.8.5. Executing OPT_MERGE pass (detect identical cells).
Finding identical cells in module `\aes_core'.
Finding identical cells in module `\top'.
Removed a total of 0 cells.

3.8.6. Executing OPT_DFF pass (perform DFF optimizations).
Adding EN signal on $procdff$9 ($adff) from module aes_core (D = $xor$../rtl/aes_core.v:20$2_Y, Q = \ciphertext).

3.8.7. Executing OPT_CLEAN pass (remove unused cells and wires).
Finding unused cells or wires in module \aes_core..
Finding unused cells or wires in module \top..
Removed 1 unused cells and 1 unused wires.
<suppressed ~2 debug messages>

3.8.8. Executing OPT_EXPR pass (perform const folding).
Optimizing module aes_core.
Optimizing module top.

3.8.9. Rerunning OPT passes. (Maybe there is more to do..)

3.8.10. Executing OPT_MUXTREE pass (detect dead branches in mux trees).
Running muxtree optimizer on module \aes_core..
  Creating internal representation of mux trees.
  Evaluating internal representation of mux trees.
  Analyzing evaluation results.
Running muxtree optimizer on module \top..
  Creating internal representation of mux trees.
  No muxes found in this module.
Removed 0 multiplexer ports.
<suppressed ~1 debug messages>

3.8.11. Executing OPT_REDUCE pass (consolidate $*mux and $reduce_* inputs).
  Optimizing cells in module \aes_core.
  Optimizing cells in module \top.
Performed a total of 0 changes.

3.8.12. Executing OPT_MERGE pass (detect identical cells).
Finding identical cells in module `\aes_core'.
Finding identical cells in module `\top'.
Removed a total of 0 cells.

3.8.13. Executing OPT_DFF pass (perform DFF optimizations).

3.8.14. Executing OPT_CLEAN pass (remove unused cells and wires).
Finding unused cells or wires in module \aes_core..
Finding unused cells or wires in module \top..

3.8.15. Executing OPT_EXPR pass (perform const folding).
Optimizing module aes_core.
Optimizing module top.

3.8.16. Finished OPT passes. (There is nothing left to do.)

3.9. Executing WREDUCE pass (reducing word size of cells).

3.10. Executing PEEPOPT pass (run peephole optimizers).

3.11. Executing OPT_CLEAN pass (remove unused cells and wires).
Finding unused cells or wires in module \aes_core..
Finding unused cells or wires in module \top..

3.12. Executing ALUMACC pass (create $alu and $macc cells).
Extracting $alu and $macc cells in module aes_core:
  created 0 $alu and 0 $macc cells.
Extracting $alu and $macc cells in module top:
  created 0 $alu and 0 $macc cells.

3.13. Executing SHARE pass (SAT-based resource sharing).

3.14. Executing OPT pass (performing simple optimizations).

3.14.1. Executing OPT_EXPR pass (perform const folding).
Optimizing module aes_core.
Optimizing module top.

3.14.2. Executing OPT_MERGE pass (detect identical cells).
Finding identical cells in module `\aes_core'.
Finding identical cells in module `\top'.
Removed a total of 0 cells.

3.14.3. Executing OPT_MUXTREE pass (detect dead branches in mux trees).
Running muxtree optimizer on module \aes_core..
  Creating internal representation of mux trees.
  Evaluating internal representation of mux trees.
  Analyzing evaluation results.
Running muxtree optimizer on module \top..
  Creating internal representation of mux trees.
  No muxes found in this module.
Removed 0 multiplexer ports.
<suppressed ~1 debug messages>

3.14.4. Executing OPT_REDUCE pass (consolidate $*mux and $reduce_* inputs).
  Optimizing cells in module \aes_core.
  Optimizing cells in module \top.
Performed a total of 0 changes.

3.14.5. Executing OPT_MERGE pass (detect identical cells).
Finding identical cells in module `\aes_core'.
Finding identical cells in module `\top'.
Removed a total of 0 cells.

3.14.6. Executing OPT_DFF pass (perform DFF optimizations).

3.14.7. Executing OPT_CLEAN pass (remove unused cells and wires).
Finding unused cells or wires in module \aes_core..
Finding unused cells or wires in module \top..

3.14.8. Executing OPT_EXPR pass (perform const folding).
Optimizing module aes_core.
Optimizing module top.

3.14.9. Finished OPT passes. (There is nothing left to do.)

3.15. Executing MEMORY pass.

3.15.1. Executing OPT_MEM pass (optimize memories).
Performed a total of 0 transformations.

3.15.2. Executing OPT_MEM_PRIORITY pass (removing unnecessary memory write priority relations).
Performed a total of 0 transformations.

3.15.3. Executing OPT_MEM_FEEDBACK pass (finding memory read-to-write feedback paths).

3.15.4. Executing MEMORY_BMUX2ROM pass (converting muxes to ROMs).

3.15.5. Executing MEMORY_DFF pass (merging $dff cells to $memrd).

3.15.6. Executing OPT_CLEAN pass (remove unused cells and wires).
Finding unused cells or wires in module \aes_core..
Finding unused cells or wires in module \top..

3.15.7. Executing MEMORY_SHARE pass (consolidating $memrd/$memwr cells).

3.15.8. Executing OPT_MEM_WIDEN pass (optimize memories where all ports are wide).
Performed a total of 0 transformations.

3.15.9. Executing OPT_CLEAN pass (remove unused cells and wires).
Finding unused cells or wires in module \aes_core..
Finding unused cells or wires in module \top..

3.15.10. Executing MEMORY_COLLECT pass (generating $mem cells).

3.16. Executing OPT_CLEAN pass (remove unused cells and wires).
Finding unused cells or wires in module \aes_core..
Finding unused cells or wires in module \top..

3.17. Executing OPT pass (performing simple optimizations).

3.17.1. Executing OPT_EXPR pass (perform const folding).
Optimizing module aes_core.
<suppressed ~1 debug messages>
Optimizing module top.

3.17.2. Executing OPT_MERGE pass (detect identical cells).
Finding identical cells in module `\aes_core'.
Finding identical cells in module `\top'.
Removed a total of 0 cells.

3.17.3. Executing OPT_DFF pass (perform DFF optimizations).

3.17.4. Executing OPT_CLEAN pass (remove unused cells and wires).
Finding unused cells or wires in module \aes_core..
Finding unused cells or wires in module \top..
Removed 0 unused cells and 1 unused wires.
<suppressed ~1 debug messages>

3.17.5. Finished fast OPT passes.

3.18. Executing MEMORY_MAP pass (converting memories to logic and flip-flops).

3.19. Executing OPT pass (performing simple optimizations).

3.19.1. Executing OPT_EXPR pass (perform const folding).
Optimizing module aes_core.
Optimizing module top.

3.19.2. Executing OPT_MERGE pass (detect identical cells).
Finding identical cells in module `\aes_core'.
Finding identical cells in module `\top'.
Removed a total of 0 cells.

3.19.3. Executing OPT_MUXTREE pass (detect dead branches in mux trees).
Running muxtree optimizer on module \aes_core..
  Creating internal representation of mux trees.
  No muxes found in this module.
Running muxtree optimizer on module \top..
  Creating internal representation of mux trees.
  No muxes found in this module.
Removed 0 multiplexer ports.

3.19.4. Executing OPT_REDUCE pass (consolidate $*mux and $reduce_* inputs).
  Optimizing cells in module \aes_core.
  Optimizing cells in module \top.
Performed a total of 0 changes.

3.19.5. Executing OPT_MERGE pass (detect identical cells).
Finding identical cells in module `\aes_core'.
Finding identical cells in module `\top'.
Removed a total of 0 cells.

3.19.6. Executing OPT_SHARE pass.

3.19.7. Executing OPT_DFF pass (perform DFF optimizations).

3.19.8. Executing OPT_CLEAN pass (remove unused cells and wires).
Finding unused cells or wires in module \aes_core..
Finding unused cells or wires in module \top..

3.19.9. Executing OPT_EXPR pass (perform const folding).
Optimizing module aes_core.
Optimizing module top.

3.19.10. Finished OPT passes. (There is nothing left to do.)

3.20. Executing TECHMAP pass (map to technology primitives).

3.20.1. Executing Verilog-2005 frontend: /usr/bin/../share/yosys/techmap.v
Parsing Verilog input from `/usr/bin/../share/yosys/techmap.v' to AST representation.
Generating RTLIL representation for module `\_90_simplemap_bool_ops'.
Generating RTLIL representation for module `\_90_simplemap_reduce_ops'.
Generating RTLIL representation for module `\_90_simplemap_logic_ops'.
Generating RTLIL representation for module `\_90_simplemap_compare_ops'.
Generating RTLIL representation for module `\_90_simplemap_various'.
Generating RTLIL representation for module `\_90_simplemap_registers'.
Generating RTLIL representation for module `\_90_shift_ops_shr_shl_sshl_sshr'.
Generating RTLIL representation for module `\_90_shift_shiftx'.
Generating RTLIL representation for module `\_90_fa'.
Generating RTLIL representation for module `\_90_lcu'.
Generating RTLIL representation for module `\_90_alu'.
Generating RTLIL representation for module `\_90_macc'.
Generating RTLIL representation for module `\_90_alumacc'.
Generating RTLIL representation for module `\$__div_mod_u'.
Generating RTLIL representation for module `\$__div_mod_trunc'.
Generating RTLIL representation for module `\_90_div'.
Generating RTLIL representation for module `\_90_mod'.
Generating RTLIL representation for module `\$__div_mod_floor'.
Generating RTLIL representation for module `\_90_divfloor'.
Generating RTLIL representation for module `\_90_modfloor'.
Generating RTLIL representation for module `\_90_pow'.
Generating RTLIL representation for module `\_90_pmux'.
Generating RTLIL representation for module `\_90_demux'.
Generating RTLIL representation for module `\_90_lut'.
Successfully finished Verilog frontend.

3.20.2. Continuing TECHMAP pass.
Using extmapper simplemap for cells of type $xor.
Using extmapper simplemap for cells of type $adffe.
Using extmapper simplemap for cells of type $adff.
No more expansions possible.
<suppressed ~76 debug messages>

3.21. Executing OPT pass (performing simple optimizations).

3.21.1. Executing OPT_EXPR pass (perform const folding).
Optimizing module aes_core.
Optimizing module top.

3.21.2. Executing OPT_MERGE pass (detect identical cells).
Finding identical cells in module `\aes_core'.
Finding identical cells in module `\top'.
Removed a total of 0 cells.

3.21.3. Executing OPT_DFF pass (perform DFF optimizations).

3.21.4. Executing OPT_CLEAN pass (remove unused cells and wires).
Finding unused cells or wires in module \aes_core..
Finding unused cells or wires in module \top..

3.21.5. Finished fast OPT passes.

3.22. Executing ABC pass (technology mapping using ABC).

3.22.1. Extracting gate netlist of module `\aes_core' to `<abc-temp-dir>/input.blif'..
Extracted 128 gates and 384 wires to a netlist network with 256 inputs and 128 outputs.

3.22.1.1. Executing ABC.
Running ABC command: "<yosys-exe-dir>/yosys-abc" -s -f <abc-temp-dir>/abc.script 2>&1
ABC: ABC command line: "source <abc-temp-dir>/abc.script".
ABC: 
ABC: + read_blif <abc-temp-dir>/input.blif 
ABC: + read_library <abc-temp-dir>/stdcells.genlib 
ABC: Entered genlib library with 13 gates from file "<abc-temp-dir>/stdcells.genlib".
ABC: + strash 
ABC: + dretime 
ABC: + map 
ABC: + write_blif <abc-temp-dir>/output.blif 

3.22.1.2. Re-integrating ABC results.
ABC RESULTS:               XOR cells:      128
ABC RESULTS:        internal signals:        0
ABC RESULTS:           input signals:      256
ABC RESULTS:          output signals:      128
Removing temp directory.

3.22.2. Extracting gate netlist of module `\top' to `<abc-temp-dir>/input.blif'..
Extracted 0 gates and 0 wires to a netlist network with 0 inputs and 0 outputs.
Don't call ABC as there is nothing to map.
Removing temp directory.

3.23. Executing OPT pass (performing simple optimizations).

3.23.1. Executing OPT_EXPR pass (perform const folding).
Optimizing module aes_core.
Optimizing module top.

3.23.2. Executing OPT_MERGE pass (detect identical cells).
Finding identical cells in module `\aes_core'.
Finding identical cells in module `\top'.
Removed a total of 0 cells.

3.23.3. Executing OPT_DFF pass (perform DFF optimizations).

3.23.4. Executing OPT_CLEAN pass (remove unused cells and wires).
Finding unused cells or wires in module \aes_core..
Finding unused cells or wires in module \top..
Removed 0 unused cells and 257 unused wires.
<suppressed ~1 debug messages>

3.23.5. Finished fast OPT passes.

3.24. Executing HIERARCHY pass (managing design hierarchy).

3.24.1. Analyzing design hierarchy..
Top module:  \top
Used module:     \aes_core

3.24.2. Analyzing design hierarchy..
Top module:  \top
Used module:     \aes_core
Removed 0 unused modules.

3.25. Printing statistics.

=== aes_core ===

   Number of wires:                135
   Number of wire bits:            516
   Number of public wires:           7
   Number of public wire bits:     388
   Number of memories:               0
   Number of memory bits:            0
   Number of processes:              0
   Number of cells:                257
     $_DFFE_PP0P_                  128
     $_DFF_PP0_                      1
     $_XOR_                        128

=== top ===

   Number of wires:                  7
   Number of wire bits:            388
   Number of public wires:           7
   Number of public wire bits:     388
   Number of memories:               0
   Number of memory bits:            0
   Number of processes:              0
   Number of cells:                  1
     aes_core                        1

=== design hierarchy ===

   top                               1
     aes_core                        1

   Number of wires:                142
   Number of wire bits:            904
   Number of public wires:          14
   Number of public wire bits:     776
   Number of memories:               0
   Number of memory bits:            0
   Number of processes:              0
   Number of cells:                257
     $_DFFE_PP0P_                  128
     $_DFF_PP0_                      1
     $_XOR_                        128

3.26. Executing CHECK pass (checking for obvious problems).
Checking module aes_core...
Checking module top...
Found and reported 0 problems.

4. Executing DFFLIBMAP pass (mapping DFF cells to sequential cells from liberty file).
Warning: Found unsupported expression 'D&!SCE|SCD&SCE' in pin attribute of cell 'sky130_fd_sc_hd__sdfbbn_1' - skipping.
Warning: Found unsupported expression 'D&!SCE|SCD&SCE' in pin attribute of cell 'sky130_fd_sc_hd__sdfbbn_2' - skipping.
Warning: Found unsupported expression 'D&!SCE|SCD&SCE' in pin attribute of cell 'sky130_fd_sc_hd__sdfrtn_1' - skipping.
Warning: Found unsupported expression 'D&DE|IQ&!DE' in pin attribute of cell 'sky130_fd_sc_hd__edfxbp_1' - skipping.
Warning: Found unsupported expression 'D&DE|IQ&!DE' in pin attribute of cell 'sky130_fd_sc_hd__edfxtp_1' - skipping.
Warning: Found unsupported expression 'D&!SCE|SCD&SCE' in pin attribute of cell 'sky130_fd_sc_hd__sdfbbp_1' - skipping.
Warning: Found unsupported expression 'D&!SCE|SCD&SCE' in pin attribute of cell 'sky130_fd_sc_hd__sdfrbp_1' - skipping.
Warning: Found unsupported expression 'D&!SCE|SCD&SCE' in pin attribute of cell 'sky130_fd_sc_hd__sdfrbp_2' - skipping.
Warning: Found unsupported expression 'D&!SCE|SCD&SCE' in pin attribute of cell 'sky130_fd_sc_hd__sdfrtp_1' - skipping.
Warning: Found unsupported expression 'D&!SCE|SCD&SCE' in pin attribute of cell 'sky130_fd_sc_hd__sdfrtp_2' - skipping.
Warning: Found unsupported expression 'D&!SCE|SCD&SCE' in pin attribute of cell 'sky130_fd_sc_hd__sdfrtp_4' - skipping.
Warning: Found unsupported expression 'D&!SCE|SCD&SCE' in pin attribute of cell 'sky130_fd_sc_hd__sdfsbp_1' - skipping.
Warning: Found unsupported expression 'D&!SCE|SCD&SCE' in pin attribute of cell 'sky130_fd_sc_hd__sdfsbp_2' - skipping.
Warning: Found unsupported expression 'D&!SCE|SCD&SCE' in pin attribute of cell 'sky130_fd_sc_hd__sdfstp_1' - skipping.
Warning: Found unsupported expression 'D&!SCE|SCD&SCE' in pin attribute of cell 'sky130_fd_sc_hd__sdfstp_2' - skipping.
Warning: Found unsupported expression 'D&!SCE|SCD&SCE' in pin attribute of cell 'sky130_fd_sc_hd__sdfstp_4' - skipping.
Warning: Found unsupported expression 'D&!SCE|SCD&SCE' in pin attribute of cell 'sky130_fd_sc_hd__sdfxbp_1' - skipping.
Warning: Found unsupported expression 'D&!SCE|SCD&SCE' in pin attribute of cell 'sky130_fd_sc_hd__sdfxbp_2' - skipping.
Warning: Found unsupported expression 'D&!SCE|SCD&SCE' in pin attribute of cell 'sky130_fd_sc_hd__sdfxtp_1' - skipping.
Warning: Found unsupported expression 'D&!SCE|SCD&SCE' in pin attribute of cell 'sky130_fd_sc_hd__sdfxtp_2' - skipping.
Warning: Found unsupported expression 'D&!SCE|SCD&SCE' in pin attribute of cell 'sky130_fd_sc_hd__sdfxtp_4' - skipping.
Warning: Found unsupported expression 'D&DE&!SCE|IQ&!DE&!SCE|SCD&SCE' in pin attribute of cell 'sky130_fd_sc_hd__sedfxbp_1' - skipping.
Warning: Found unsupported expression 'D&DE&!SCE|IQ&!DE&!SCE|SCD&SCE' in pin attribute of cell 'sky130_fd_sc_hd__sedfxbp_2' - skipping.
Warning: Found unsupported expression 'D&DE&!SCE|IQ&!DE&!SCE|SCD&SCE' in pin attribute of cell 'sky130_fd_sc_hd__sedfxtp_1' - skipping.
Warning: Found unsupported expression 'D&DE&!SCE|IQ&!DE&!SCE|SCD&SCE' in pin attribute of cell 'sky130_fd_sc_hd__sedfxtp_2' - skipping.
Warning: Found unsupported expression 'D&DE&!SCE|IQ&!DE&!SCE|SCD&SCE' in pin attribute of cell 'sky130_fd_sc_hd__sedfxtp_4' - skipping.
  cell sky130_fd_sc_hd__dfxtp_1 (noninv, pins=3, area=20.02) is a direct match for cell type $_DFF_P_.
Warning: Found unsupported expression 'D&!SCE|SCD&SCE' in pin attribute of cell 'sky130_fd_sc_hd__sdfbbn_1' - skipping.
Warning: Found unsupported expression 'D&!SCE|SCD&SCE' in pin attribute of cell 'sky130_fd_sc_hd__sdfbbn_2' - skipping.
Warning: Found unsupported expression 'D&!SCE|SCD&SCE' in pin attribute of cell 'sky130_fd_sc_hd__sdfrtn_1' - skipping.
  cell sky130_fd_sc_hd__dfrtn_1 (noninv, pins=4, area=25.02) is a direct match for cell type $_DFF_NN0_.
Warning: Found unsupported expression 'D&!SCE|SCD&SCE' in pin attribute of cell 'sky130_fd_sc_hd__sdfbbn_1' - skipping.
Warning: Found unsupported expression 'D&!SCE|SCD&SCE' in pin attribute of cell 'sky130_fd_sc_hd__sdfbbn_2' - skipping.
Warning: Found unsupported expression 'D&!SCE|SCD&SCE' in pin attribute of cell 'sky130_fd_sc_hd__sdfrtn_1' - skipping.
Warning: Found unsupported expression 'D&!SCE|SCD&SCE' in pin attribute of cell 'sky130_fd_sc_hd__sdfbbn_1' - skipping.
Warning: Found unsupported expression 'D&!SCE|SCD&SCE' in pin attribute of cell 'sky130_fd_sc_hd__sdfbbn_2' - skipping.
Warning: Found unsupported expression 'D&!SCE|SCD&SCE' in pin attribute of cell 'sky130_fd_sc_hd__sdfrtn_1' - skipping.
Warning: Found unsupported expression 'D&!SCE|SCD&SCE' in pin attribute of cell 'sky130_fd_sc_hd__sdfbbn_1' - skipping.
Warning: Found unsupported expression 'D&!SCE|SCD&SCE' in pin attribute of cell 'sky130_fd_sc_hd__sdfbbn_2' - skipping.
Warning: Found unsupported expression 'D&!SCE|SCD&SCE' in pin attribute of cell 'sky130_fd_sc_hd__sdfrtn_1' - skipping.
Warning: Found unsupported expression 'D&DE|IQ&!DE' in pin attribute of cell 'sky130_fd_sc_hd__edfxbp_1' - skipping.
Warning: Found unsupported expression 'D&DE|IQ&!DE' in pin attribute of cell 'sky130_fd_sc_hd__edfxtp_1' - skipping.
Warning: Found unsupported expression 'D&!SCE|SCD&SCE' in pin attribute of cell 'sky130_fd_sc_hd__sdfbbp_1' - skipping.
Warning: Found unsupported expression 'D&!SCE|SCD&SCE' in pin attribute of cell 'sky130_fd_sc_hd__sdfrbp_1' - skipping.
Warning: Found unsupported expression 'D&!SCE|SCD&SCE' in pin attribute of cell 'sky130_fd_sc_hd__sdfrbp_2' - skipping.
Warning: Found unsupported expression 'D&!SCE|SCD&SCE' in pin attribute of cell 'sky130_fd_sc_hd__sdfrtp_1' - skipping.
Warning: Found unsupported expression 'D&!SCE|SCD&SCE' in pin attribute of cell 'sky130_fd_sc_hd__sdfrtp_2' - skipping.
Warning: Found unsupported expression 'D&!SCE|SCD&SCE' in pin attribute of cell 'sky130_fd_sc_hd__sdfrtp_4' - skipping.
Warning: Found unsupported expression 'D&!SCE|SCD&SCE' in pin attribute of cell 'sky130_fd_sc_hd__sdfsbp_1' - skipping.
Warning: Found unsupported expression 'D&!SCE|SCD&SCE' in pin attribute of cell 'sky130_fd_sc_hd__sdfsbp_2' - skipping.
Warning: Found unsupported expression 'D&!SCE|SCD&SCE' in pin attribute of cell 'sky130_fd_sc_hd__sdfstp_1' - skipping.
Warning: Found unsupported expression 'D&!SCE|SCD&SCE' in pin attribute of cell 'sky130_fd_sc_hd__sdfstp_2' - skipping.
Warning: Found unsupported expression 'D&!SCE|SCD&SCE' in pin attribute of cell 'sky130_fd_sc_hd__sdfstp_4' - skipping.
Warning: Found unsupported expression 'D&!SCE|SCD&SCE' in pin attribute of cell 'sky130_fd_sc_hd__sdfxbp_1' - skipping.
Warning: Found unsupported expression 'D&!SCE|SCD&SCE' in pin attribute of cell 'sky130_fd_sc_hd__sdfxbp_2' - skipping.
Warning: Found unsupported expression 'D&!SCE|SCD&SCE' in pin attribute of cell 'sky130_fd_sc_hd__sdfxtp_1' - skipping.
Warning: Found unsupported expression 'D&!SCE|SCD&SCE' in pin attribute of cell 'sky130_fd_sc_hd__sdfxtp_2' - skipping.
Warning: Found unsupported expression 'D&!SCE|SCD&SCE' in pin attribute of cell 'sky130_fd_sc_hd__sdfxtp_4' - skipping.
Warning: Found unsupported expression 'D&DE&!SCE|IQ&!DE&!SCE|SCD&SCE' in pin attribute of cell 'sky130_fd_sc_hd__sedfxbp_1' - skipping.
Warning: Found unsupported expression 'D&DE&!SCE|IQ&!DE&!SCE|SCD&SCE' in pin attribute of cell 'sky130_fd_sc_hd__sedfxbp_2' - skipping.
Warning: Found unsupported expression 'D&DE&!SCE|IQ&!DE&!SCE|SCD&SCE' in pin attribute of cell 'sky130_fd_sc_hd__sedfxtp_1' - skipping.
Warning: Found unsupported expression 'D&DE&!SCE|IQ&!DE&!SCE|SCD&SCE' in pin attribute of cell 'sky130_fd_sc_hd__sedfxtp_2' - skipping.
Warning: Found unsupported expression 'D&DE&!SCE|IQ&!DE&!SCE|SCD&SCE' in pin attribute of cell 'sky130_fd_sc_hd__sedfxtp_4' - skipping.
  cell sky130_fd_sc_hd__dfrtp_1 (noninv, pins=4, area=25.02) is a direct match for cell type $_DFF_PN0_.
Warning: Found unsupported expression 'D&DE|IQ&!DE' in pin attribute of cell 'sky130_fd_sc_hd__edfxbp_1' - skipping.
Warning: Found unsupported expression 'D&DE|IQ&!DE' in pin attribute of cell 'sky130_fd_sc_hd__edfxtp_1' - skipping.
Warning: Found unsupported expression 'D&!SCE|SCD&SCE' in pin attribute of cell 'sky130_fd_sc_hd__sdfbbp_1' - skipping.
Warning: Found unsupported expression 'D&!SCE|SCD&SCE' in pin attribute of cell 'sky130_fd_sc_hd__sdfrbp_1' - skipping.
Warning: Found unsupported expression 'D&!SCE|SCD&SCE' in pin attribute of cell 'sky130_fd_sc_hd__sdfrbp_2' - skipping.
Warning: Found unsupported expression 'D&!SCE|SCD&SCE' in pin attribute of cell 'sky130_fd_sc_hd__sdfrtp_1' - skipping.
Warning: Found unsupported expression 'D&!SCE|SCD&SCE' in pin attribute of cell 'sky130_fd_sc_hd__sdfrtp_2' - skipping.
Warning: Found unsupported expression 'D&!SCE|SCD&SCE' in pin attribute of cell 'sky130_fd_sc_hd__sdfrtp_4' - skipping.
Warning: Found unsupported expression 'D&!SCE|SCD&SCE' in pin attribute of cell 'sky130_fd_sc_hd__sdfsbp_1' - skipping.
Warning: Found unsupported expression 'D&!SCE|SCD&SCE' in pin attribute of cell 'sky130_fd_sc_hd__sdfsbp_2' - skipping.
Warning: Found unsupported expression 'D&!SCE|SCD&SCE' in pin attribute of cell 'sky130_fd_sc_hd__sdfstp_1' - skipping.
Warning: Found unsupported expression 'D&!SCE|SCD&SCE' in pin attribute of cell 'sky130_fd_sc_hd__sdfstp_2' - skipping.
Warning: Found unsupported expression 'D&!SCE|SCD&SCE' in pin attribute of cell 'sky130_fd_sc_hd__sdfstp_4' - skipping.
Warning: Found unsupported expression 'D&!SCE|SCD&SCE' in pin attribute of cell 'sky130_fd_sc_hd__sdfxbp_1' - skipping.
Warning: Found unsupported expression 'D&!SCE|SCD&SCE' in pin attribute of cell 'sky130_fd_sc_hd__sdfxbp_2' - skipping.
Warning: Found unsupported expression 'D&!SCE|SCD&SCE' in pin attribute of cell 'sky130_fd_sc_hd__sdfxtp_1' - skipping.
Warning: Found unsupported expression 'D&!SCE|SCD&SCE' in pin attribute of cell 'sky130_fd_sc_hd__sdfxtp_2' - skipping.
Warning: Found unsupported expression 'D&!SCE|SCD&SCE' in pin attribute of cell 'sky130_fd_sc_hd__sdfxtp_4' - skipping.
Warning: Found unsupported expression 'D&DE&!SCE|IQ&!DE&!SCE|SCD&SCE' in pin attribute of cell 'sky130_fd_sc_hd__sedfxbp_1' - skipping.
Warning: Found unsupported expression 'D&DE&!SCE|IQ&!DE&!SCE|SCD&SCE' in pin attribute of cell 'sky130_fd_sc_hd__sedfxbp_2' - skipping.
Warning: Found unsupported expression 'D&DE&!SCE|IQ&!DE&!SCE|SCD&SCE' in pin attribute of cell 'sky130_fd_sc_hd__sedfxtp_1' - skipping.
Warning: Found unsupported expression 'D&DE&!SCE|IQ&!DE&!SCE|SCD&SCE' in pin attribute of cell 'sky130_fd_sc_hd__sedfxtp_2' - skipping.
Warning: Found unsupported expression 'D&DE&!SCE|IQ&!DE&!SCE|SCD&SCE' in pin attribute of cell 'sky130_fd_sc_hd__sedfxtp_4' - skipping.
  cell sky130_fd_sc_hd__dfstp_2 (noninv, pins=4, area=26.28) is a direct match for cell type $_DFF_PN1_.
Warning: Found unsupported expression 'D&DE|IQ&!DE' in pin attribute of cell 'sky130_fd_sc_hd__edfxbp_1' - skipping.
Warning: Found unsupported expression 'D&DE|IQ&!DE' in pin attribute of cell 'sky130_fd_sc_hd__edfxtp_1' - skipping.
Warning: Found unsupported expression 'D&!SCE|SCD&SCE' in pin attribute of cell 'sky130_fd_sc_hd__sdfbbp_1' - skipping.
Warning: Found unsupported expression 'D&!SCE|SCD&SCE' in pin attribute of cell 'sky130_fd_sc_hd__sdfrbp_1' - skipping.
Warning: Found unsupported expression 'D&!SCE|SCD&SCE' in pin attribute of cell 'sky130_fd_sc_hd__sdfrbp_2' - skipping.
Warning: Found unsupported expression 'D&!SCE|SCD&SCE' in pin attribute of cell 'sky130_fd_sc_hd__sdfrtp_1' - skipping.
Warning: Found unsupported expression 'D&!SCE|SCD&SCE' in pin attribute of cell 'sky130_fd_sc_hd__sdfrtp_2' - skipping.
Warning: Found unsupported expression 'D&!SCE|SCD&SCE' in pin attribute of cell 'sky130_fd_sc_hd__sdfrtp_4' - skipping.
Warning: Found unsupported expression 'D&!SCE|SCD&SCE' in pin attribute of cell 'sky130_fd_sc_hd__sdfsbp_1' - skipping.
Warning: Found unsupported expression 'D&!SCE|SCD&SCE' in pin attribute of cell 'sky130_fd_sc_hd__sdfsbp_2' - skipping.
Warning: Found unsupported expression 'D&!SCE|SCD&SCE' in pin attribute of cell 'sky130_fd_sc_hd__sdfstp_1' - skipping.
Warning: Found unsupported expression 'D&!SCE|SCD&SCE' in pin attribute of cell 'sky130_fd_sc_hd__sdfstp_2' - skipping.
Warning: Found unsupported expression 'D&!SCE|SCD&SCE' in pin attribute of cell 'sky130_fd_sc_hd__sdfstp_4' - skipping.
Warning: Found unsupported expression 'D&!SCE|SCD&SCE' in pin attribute of cell 'sky130_fd_sc_hd__sdfxbp_1' - skipping.
Warning: Found unsupported expression 'D&!SCE|SCD&SCE' in pin attribute of cell 'sky130_fd_sc_hd__sdfxbp_2' - skipping.
Warning: Found unsupported expression 'D&!SCE|SCD&SCE' in pin attribute of cell 'sky130_fd_sc_hd__sdfxtp_1' - skipping.
Warning: Found unsupported expression 'D&!SCE|SCD&SCE' in pin attribute of cell 'sky130_fd_sc_hd__sdfxtp_2' - skipping.
Warning: Found unsupported expression 'D&!SCE|SCD&SCE' in pin attribute of cell 'sky130_fd_sc_hd__sdfxtp_4' - skipping.
Warning: Found unsupported expression 'D&DE&!SCE|IQ&!DE&!SCE|SCD&SCE' in pin attribute of cell 'sky130_fd_sc_hd__sedfxbp_1' - skipping.
Warning: Found unsupported expression 'D&DE&!SCE|IQ&!DE&!SCE|SCD&SCE' in pin attribute of cell 'sky130_fd_sc_hd__sedfxbp_2' - skipping.
Warning: Found unsupported expression 'D&DE&!SCE|IQ&!DE&!SCE|SCD&SCE' in pin attribute of cell 'sky130_fd_sc_hd__sedfxtp_1' - skipping.
Warning: Found unsupported expression 'D&DE&!SCE|IQ&!DE&!SCE|SCD&SCE' in pin attribute of cell 'sky130_fd_sc_hd__sedfxtp_2' - skipping.
Warning: Found unsupported expression 'D&DE&!SCE|IQ&!DE&!SCE|SCD&SCE' in pin attribute of cell 'sky130_fd_sc_hd__sedfxtp_4' - skipping.
Warning: Found unsupported expression 'D&DE|IQ&!DE' in pin attribute of cell 'sky130_fd_sc_hd__edfxbp_1' - skipping.
Warning: Found unsupported expression 'D&DE|IQ&!DE' in pin attribute of cell 'sky130_fd_sc_hd__edfxtp_1' - skipping.
Warning: Found unsupported expression 'D&!SCE|SCD&SCE' in pin attribute of cell 'sky130_fd_sc_hd__sdfbbp_1' - skipping.
Warning: Found unsupported expression 'D&!SCE|SCD&SCE' in pin attribute of cell 'sky130_fd_sc_hd__sdfrbp_1' - skipping.
Warning: Found unsupported expression 'D&!SCE|SCD&SCE' in pin attribute of cell 'sky130_fd_sc_hd__sdfrbp_2' - skipping.
Warning: Found unsupported expression 'D&!SCE|SCD&SCE' in pin attribute of cell 'sky130_fd_sc_hd__sdfrtp_1' - skipping.
Warning: Found unsupported expression 'D&!SCE|SCD&SCE' in pin attribute of cell 'sky130_fd_sc_hd__sdfrtp_2' - skipping.
Warning: Found unsupported expression 'D&!SCE|SCD&SCE' in pin attribute of cell 'sky130_fd_sc_hd__sdfrtp_4' - skipping.
Warning: Found unsupported expression 'D&!SCE|SCD&SCE' in pin attribute of cell 'sky130_fd_sc_hd__sdfsbp_1' - skipping.
Warning: Found unsupported expression 'D&!SCE|SCD&SCE' in pin attribute of cell 'sky130_fd_sc_hd__sdfsbp_2' - skipping.
Warning: Found unsupported expression 'D&!SCE|SCD&SCE' in pin attribute of cell 'sky130_fd_sc_hd__sdfstp_1' - skipping.
Warning: Found unsupported expression 'D&!SCE|SCD&SCE' in pin attribute of cell 'sky130_fd_sc_hd__sdfstp_2' - skipping.
Warning: Found unsupported expression 'D&!SCE|SCD&SCE' in pin attribute of cell 'sky130_fd_sc_hd__sdfstp_4' - skipping.
Warning: Found unsupported expression 'D&!SCE|SCD&SCE' in pin attribute of cell 'sky130_fd_sc_hd__sdfxbp_1' - skipping.
Warning: Found unsupported expression 'D&!SCE|SCD&SCE' in pin attribute of cell 'sky130_fd_sc_hd__sdfxbp_2' - skipping.
Warning: Found unsupported expression 'D&!SCE|SCD&SCE' in pin attribute of cell 'sky130_fd_sc_hd__sdfxtp_1' - skipping.
Warning: Found unsupported expression 'D&!SCE|SCD&SCE' in pin attribute of cell 'sky130_fd_sc_hd__sdfxtp_2' - skipping.
Warning: Found unsupported expression 'D&!SCE|SCD&SCE' in pin attribute of cell 'sky130_fd_sc_hd__sdfxtp_4' - skipping.
Warning: Found unsupported expression 'D&DE&!SCE|IQ&!DE&!SCE|SCD&SCE' in pin attribute of cell 'sky130_fd_sc_hd__sedfxbp_1' - skipping.
Warning: Found unsupported expression 'D&DE&!SCE|IQ&!DE&!SCE|SCD&SCE' in pin attribute of cell 'sky130_fd_sc_hd__sedfxbp_2' - skipping.
Warning: Found unsupported expression 'D&DE&!SCE|IQ&!DE&!SCE|SCD&SCE' in pin attribute of cell 'sky130_fd_sc_hd__sedfxtp_1' - skipping.
Warning: Found unsupported expression 'D&DE&!SCE|IQ&!DE&!SCE|SCD&SCE' in pin attribute of cell 'sky130_fd_sc_hd__sedfxtp_2' - skipping.
Warning: Found unsupported expression 'D&DE&!SCE|IQ&!DE&!SCE|SCD&SCE' in pin attribute of cell 'sky130_fd_sc_hd__sedfxtp_4' - skipping.
Warning: Found unsupported expression 'D&!SCE|SCD&SCE' in pin attribute of cell 'sky130_fd_sc_hd__sdfbbn_1' - skipping.
Warning: Found unsupported expression 'D&!SCE|SCD&SCE' in pin attribute of cell 'sky130_fd_sc_hd__sdfbbn_2' - skipping.
Warning: Found unsupported expression 'D&!SCE|SCD&SCE' in pin attribute of cell 'sky130_fd_sc_hd__sdfrtn_1' - skipping.
  cell sky130_fd_sc_hd__dfbbn_1 (noninv, pins=6, area=32.53) is a direct match for cell type $_DFFSR_NNN_.
Warning: Found unsupported expression 'D&!SCE|SCD&SCE' in pin attribute of cell 'sky130_fd_sc_hd__sdfbbn_1' - skipping.
Warning: Found unsupported expression 'D&!SCE|SCD&SCE' in pin attribute of cell 'sky130_fd_sc_hd__sdfbbn_2' - skipping.
Warning: Found unsupported expression 'D&!SCE|SCD&SCE' in pin attribute of cell 'sky130_fd_sc_hd__sdfrtn_1' - skipping.
Warning: Found unsupported expression 'D&!SCE|SCD&SCE' in pin attribute of cell 'sky130_fd_sc_hd__sdfbbn_1' - skipping.
Warning: Found unsupported expression 'D&!SCE|SCD&SCE' in pin attribute of cell 'sky130_fd_sc_hd__sdfbbn_2' - skipping.
Warning: Found unsupported expression 'D&!SCE|SCD&SCE' in pin attribute of cell 'sky130_fd_sc_hd__sdfrtn_1' - skipping.
Warning: Found unsupported expression 'D&!SCE|SCD&SCE' in pin attribute of cell 'sky130_fd_sc_hd__sdfbbn_1' - skipping.
Warning: Found unsupported expression 'D&!SCE|SCD&SCE' in pin attribute of cell 'sky130_fd_sc_hd__sdfbbn_2' - skipping.
Warning: Found unsupported expression 'D&!SCE|SCD&SCE' in pin attribute of cell 'sky130_fd_sc_hd__sdfrtn_1' - skipping.
Warning: Found unsupported expression 'D&DE|IQ&!DE' in pin attribute of cell 'sky130_fd_sc_hd__edfxbp_1' - skipping.
Warning: Found unsupported expression 'D&DE|IQ&!DE' in pin attribute of cell 'sky130_fd_sc_hd__edfxtp_1' - skipping.
Warning: Found unsupported expression 'D&!SCE|SCD&SCE' in pin attribute of cell 'sky130_fd_sc_hd__sdfbbp_1' - skipping.
Warning: Found unsupported expression 'D&!SCE|SCD&SCE' in pin attribute of cell 'sky130_fd_sc_hd__sdfrbp_1' - skipping.
Warning: Found unsupported expression 'D&!SCE|SCD&SCE' in pin attribute of cell 'sky130_fd_sc_hd__sdfrbp_2' - skipping.
Warning: Found unsupported expression 'D&!SCE|SCD&SCE' in pin attribute of cell 'sky130_fd_sc_hd__sdfrtp_1' - skipping.
Warning: Found unsupported expression 'D&!SCE|SCD&SCE' in pin attribute of cell 'sky130_fd_sc_hd__sdfrtp_2' - skipping.
Warning: Found unsupported expression 'D&!SCE|SCD&SCE' in pin attribute of cell 'sky130_fd_sc_hd__sdfrtp_4' - skipping.
Warning: Found unsupported expression 'D&!SCE|SCD&SCE' in pin attribute of cell 'sky130_fd_sc_hd__sdfsbp_1' - skipping.
Warning: Found unsupported expression 'D&!SCE|SCD&SCE' in pin attribute of cell 'sky130_fd_sc_hd__sdfsbp_2' - skipping.
Warning: Found unsupported expression 'D&!SCE|SCD&SCE' in pin attribute of cell 'sky130_fd_sc_hd__sdfstp_1' - skipping.
Warning: Found unsupported expression 'D&!SCE|SCD&SCE' in pin attribute of cell 'sky130_fd_sc_hd__sdfstp_2' - skipping.
Warning: Found unsupported expression 'D&!SCE|SCD&SCE' in pin attribute of cell 'sky130_fd_sc_hd__sdfstp_4' - skipping.
Warning: Found unsupported expression 'D&!SCE|SCD&SCE' in pin attribute of cell 'sky130_fd_sc_hd__sdfxbp_1' - skipping.
Warning: Found unsupported expression 'D&!SCE|SCD&SCE' in pin attribute of cell 'sky130_fd_sc_hd__sdfxbp_2' - skipping.
Warning: Found unsupported expression 'D&!SCE|SCD&SCE' in pin attribute of cell 'sky130_fd_sc_hd__sdfxtp_1' - skipping.
Warning: Found unsupported expression 'D&!SCE|SCD&SCE' in pin attribute of cell 'sky130_fd_sc_hd__sdfxtp_2' - skipping.
Warning: Found unsupported expression 'D&!SCE|SCD&SCE' in pin attribute of cell 'sky130_fd_sc_hd__sdfxtp_4' - skipping.
Warning: Found unsupported expression 'D&DE&!SCE|IQ&!DE&!SCE|SCD&SCE' in pin attribute of cell 'sky130_fd_sc_hd__sedfxbp_1' - skipping.
Warning: Found unsupported expression 'D&DE&!SCE|IQ&!DE&!SCE|SCD&SCE' in pin attribute of cell 'sky130_fd_sc_hd__sedfxbp_2' - skipping.
Warning: Found unsupported expression 'D&DE&!SCE|IQ&!DE&!SCE|SCD&SCE' in pin attribute of cell 'sky130_fd_sc_hd__sedfxtp_1' - skipping.
Warning: Found unsupported expression 'D&DE&!SCE|IQ&!DE&!SCE|SCD&SCE' in pin attribute of cell 'sky130_fd_sc_hd__sedfxtp_2' - skipping.
Warning: Found unsupported expression 'D&DE&!SCE|IQ&!DE&!SCE|SCD&SCE' in pin attribute of cell 'sky130_fd_sc_hd__sedfxtp_4' - skipping.
  cell sky130_fd_sc_hd__dfbbp_1 (noninv, pins=6, area=32.53) is a direct match for cell type $_DFFSR_PNN_.
Warning: Found unsupported expression 'D&DE|IQ&!DE' in pin attribute of cell 'sky130_fd_sc_hd__edfxbp_1' - skipping.
Warning: Found unsupported expression 'D&DE|IQ&!DE' in pin attribute of cell 'sky130_fd_sc_hd__edfxtp_1' - skipping.
Warning: Found unsupported expression 'D&!SCE|SCD&SCE' in pin attribute of cell 'sky130_fd_sc_hd__sdfbbp_1' - skipping.
Warning: Found unsupported expression 'D&!SCE|SCD&SCE' in pin attribute of cell 'sky130_fd_sc_hd__sdfrbp_1' - skipping.
Warning: Found unsupported expression 'D&!SCE|SCD&SCE' in pin attribute of cell 'sky130_fd_sc_hd__sdfrbp_2' - skipping.
Warning: Found unsupported expression 'D&!SCE|SCD&SCE' in pin attribute of cell 'sky130_fd_sc_hd__sdfrtp_1' - skipping.
Warning: Found unsupported expression 'D&!SCE|SCD&SCE' in pin attribute of cell 'sky130_fd_sc_hd__sdfrtp_2' - skipping.
Warning: Found unsupported expression 'D&!SCE|SCD&SCE' in pin attribute of cell 'sky130_fd_sc_hd__sdfrtp_4' - skipping.
Warning: Found unsupported expression 'D&!SCE|SCD&SCE' in pin attribute of cell 'sky130_fd_sc_hd__sdfsbp_1' - skipping.
Warning: Found unsupported expression 'D&!SCE|SCD&SCE' in pin attribute of cell 'sky130_fd_sc_hd__sdfsbp_2' - skipping.
Warning: Found unsupported expression 'D&!SCE|SCD&SCE' in pin attribute of cell 'sky130_fd_sc_hd__sdfstp_1' - skipping.
Warning: Found unsupported expression 'D&!SCE|SCD&SCE' in pin attribute of cell 'sky130_fd_sc_hd__sdfstp_2' - skipping.
Warning: Found unsupported expression 'D&!SCE|SCD&SCE' in pin attribute of cell 'sky130_fd_sc_hd__sdfstp_4' - skipping.
Warning: Found unsupported expression 'D&!SCE|SCD&SCE' in pin attribute of cell 'sky130_fd_sc_hd__sdfxbp_1' - skipping.
Warning: Found unsupported expression 'D&!SCE|SCD&SCE' in pin attribute of cell 'sky130_fd_sc_hd__sdfxbp_2' - skipping.
Warning: Found unsupported expression 'D&!SCE|SCD&SCE' in pin attribute of cell 'sky130_fd_sc_hd__sdfxtp_1' - skipping.
Warning: Found unsupported expression 'D&!SCE|SCD&SCE' in pin attribute of cell 'sky130_fd_sc_hd__sdfxtp_2' - skipping.
Warning: Found unsupported expression 'D&!SCE|SCD&SCE' in pin attribute of cell 'sky130_fd_sc_hd__sdfxtp_4' - skipping.
Warning: Found unsupported expression 'D&DE&!SCE|IQ&!DE&!SCE|SCD&SCE' in pin attribute of cell 'sky130_fd_sc_hd__sedfxbp_1' - skipping.
Warning: Found unsupported expression 'D&DE&!SCE|IQ&!DE&!SCE|SCD&SCE' in pin attribute of cell 'sky130_fd_sc_hd__sedfxbp_2' - skipping.
Warning: Found unsupported expression 'D&DE&!SCE|IQ&!DE&!SCE|SCD&SCE' in pin attribute of cell 'sky130_fd_sc_hd__sedfxtp_1' - skipping.
Warning: Found unsupported expression 'D&DE&!SCE|IQ&!DE&!SCE|SCD&SCE' in pin attribute of cell 'sky130_fd_sc_hd__sedfxtp_2' - skipping.
Warning: Found unsupported expression 'D&DE&!SCE|IQ&!DE&!SCE|SCD&SCE' in pin attribute of cell 'sky130_fd_sc_hd__sedfxtp_4' - skipping.
Warning: Found unsupported expression 'D&DE|IQ&!DE' in pin attribute of cell 'sky130_fd_sc_hd__edfxbp_1' - skipping.
Warning: Found unsupported expression 'D&DE|IQ&!DE' in pin attribute of cell 'sky130_fd_sc_hd__edfxtp_1' - skipping.
Warning: Found unsupported expression 'D&!SCE|SCD&SCE' in pin attribute of cell 'sky130_fd_sc_hd__sdfbbp_1' - skipping.
Warning: Found unsupported expression 'D&!SCE|SCD&SCE' in pin attribute of cell 'sky130_fd_sc_hd__sdfrbp_1' - skipping.
Warning: Found unsupported expression 'D&!SCE|SCD&SCE' in pin attribute of cell 'sky130_fd_sc_hd__sdfrbp_2' - skipping.
Warning: Found unsupported expression 'D&!SCE|SCD&SCE' in pin attribute of cell 'sky130_fd_sc_hd__sdfrtp_1' - skipping.
Warning: Found unsupported expression 'D&!SCE|SCD&SCE' in pin attribute of cell 'sky130_fd_sc_hd__sdfrtp_2' - skipping.
Warning: Found unsupported expression 'D&!SCE|SCD&SCE' in pin attribute of cell 'sky130_fd_sc_hd__sdfrtp_4' - skipping.
Warning: Found unsupported expression 'D&!SCE|SCD&SCE' in pin attribute of cell 'sky130_fd_sc_hd__sdfsbp_1' - skipping.
Warning: Found unsupported expression 'D&!SCE|SCD&SCE' in pin attribute of cell 'sky130_fd_sc_hd__sdfsbp_2' - skipping.
Warning: Found unsupported expression 'D&!SCE|SCD&SCE' in pin attribute of cell 'sky130_fd_sc_hd__sdfstp_1' - skipping.
Warning: Found unsupported expression 'D&!SCE|SCD&SCE' in pin attribute of cell 'sky130_fd_sc_hd__sdfstp_2' - skipping.
Warning: Found unsupported expression 'D&!SCE|SCD&SCE' in pin attribute of cell 'sky130_fd_sc_hd__sdfstp_4' - skipping.
Warning: Found unsupported expression 'D&!SCE|SCD&SCE' in pin attribute of cell 'sky130_fd_sc_hd__sdfxbp_1' - skipping.
Warning: Found unsupported expression 'D&!SCE|SCD&SCE' in pin attribute of cell 'sky130_fd_sc_hd__sdfxbp_2' - skipping.
Warning: Found unsupported expression 'D&!SCE|SCD&SCE' in pin attribute of cell 'sky130_fd_sc_hd__sdfxtp_1' - skipping.
Warning: Found unsupported expression 'D&!SCE|SCD&SCE' in pin attribute of cell 'sky130_fd_sc_hd__sdfxtp_2' - skipping.
Warning: Found unsupported expression 'D&!SCE|SCD&SCE' in pin attribute of cell 'sky130_fd_sc_hd__sdfxtp_4' - skipping.
Warning: Found unsupported expression 'D&DE&!SCE|IQ&!DE&!SCE|SCD&SCE' in pin attribute of cell 'sky130_fd_sc_hd__sedfxbp_1' - skipping.
Warning: Found unsupported expression 'D&DE&!SCE|IQ&!DE&!SCE|SCD&SCE' in pin attribute of cell 'sky130_fd_sc_hd__sedfxbp_2' - skipping.
Warning: Found unsupported expression 'D&DE&!SCE|IQ&!DE&!SCE|SCD&SCE' in pin attribute of cell 'sky130_fd_sc_hd__sedfxtp_1' - skipping.
Warning: Found unsupported expression 'D&DE&!SCE|IQ&!DE&!SCE|SCD&SCE' in pin attribute of cell 'sky130_fd_sc_hd__sedfxtp_2' - skipping.
Warning: Found unsupported expression 'D&DE&!SCE|IQ&!DE&!SCE|SCD&SCE' in pin attribute of cell 'sky130_fd_sc_hd__sedfxtp_4' - skipping.
Warning: Found unsupported expression 'D&DE|IQ&!DE' in pin attribute of cell 'sky130_fd_sc_hd__edfxbp_1' - skipping.
Warning: Found unsupported expression 'D&DE|IQ&!DE' in pin attribute of cell 'sky130_fd_sc_hd__edfxtp_1' - skipping.
Warning: Found unsupported expression 'D&!SCE|SCD&SCE' in pin attribute of cell 'sky130_fd_sc_hd__sdfbbp_1' - skipping.
Warning: Found unsupported expression 'D&!SCE|SCD&SCE' in pin attribute of cell 'sky130_fd_sc_hd__sdfrbp_1' - skipping.
Warning: Found unsupported expression 'D&!SCE|SCD&SCE' in pin attribute of cell 'sky130_fd_sc_hd__sdfrbp_2' - skipping.
Warning: Found unsupported expression 'D&!SCE|SCD&SCE' in pin attribute of cell 'sky130_fd_sc_hd__sdfrtp_1' - skipping.
Warning: Found unsupported expression 'D&!SCE|SCD&SCE' in pin attribute of cell 'sky130_fd_sc_hd__sdfrtp_2' - skipping.
Warning: Found unsupported expression 'D&!SCE|SCD&SCE' in pin attribute of cell 'sky130_fd_sc_hd__sdfrtp_4' - skipping.
Warning: Found unsupported expression 'D&!SCE|SCD&SCE' in pin attribute of cell 'sky130_fd_sc_hd__sdfsbp_1' - skipping.
Warning: Found unsupported expression 'D&!SCE|SCD&SCE' in pin attribute of cell 'sky130_fd_sc_hd__sdfsbp_2' - skipping.
Warning: Found unsupported expression 'D&!SCE|SCD&SCE' in pin attribute of cell 'sky130_fd_sc_hd__sdfstp_1' - skipping.
Warning: Found unsupported expression 'D&!SCE|SCD&SCE' in pin attribute of cell 'sky130_fd_sc_hd__sdfstp_2' - skipping.
Warning: Found unsupported expression 'D&!SCE|SCD&SCE' in pin attribute of cell 'sky130_fd_sc_hd__sdfstp_4' - skipping.
Warning: Found unsupported expression 'D&!SCE|SCD&SCE' in pin attribute of cell 'sky130_fd_sc_hd__sdfxbp_1' - skipping.
Warning: Found unsupported expression 'D&!SCE|SCD&SCE' in pin attribute of cell 'sky130_fd_sc_hd__sdfxbp_2' - skipping.
Warning: Found unsupported expression 'D&!SCE|SCD&SCE' in pin attribute of cell 'sky130_fd_sc_hd__sdfxtp_1' - skipping.
Warning: Found unsupported expression 'D&!SCE|SCD&SCE' in pin attribute of cell 'sky130_fd_sc_hd__sdfxtp_2' - skipping.
Warning: Found unsupported expression 'D&!SCE|SCD&SCE' in pin attribute of cell 'sky130_fd_sc_hd__sdfxtp_4' - skipping.
Warning: Found unsupported expression 'D&DE&!SCE|IQ&!DE&!SCE|SCD&SCE' in pin attribute of cell 'sky130_fd_sc_hd__sedfxbp_1' - skipping.
Warning: Found unsupported expression 'D&DE&!SCE|IQ&!DE&!SCE|SCD&SCE' in pin attribute of cell 'sky130_fd_sc_hd__sedfxbp_2' - skipping.
Warning: Found unsupported expression 'D&DE&!SCE|IQ&!DE&!SCE|SCD&SCE' in pin attribute of cell 'sky130_fd_sc_hd__sedfxtp_1' - skipping.
Warning: Found unsupported expression 'D&DE&!SCE|IQ&!DE&!SCE|SCD&SCE' in pin attribute of cell 'sky130_fd_sc_hd__sedfxtp_2' - skipping.
Warning: Found unsupported expression 'D&DE&!SCE|IQ&!DE&!SCE|SCD&SCE' in pin attribute of cell 'sky130_fd_sc_hd__sedfxtp_4' - skipping.
  final dff cell mappings:
    unmapped dff cell: $_DFF_N_
    \sky130_fd_sc_hd__dfxtp_1 _DFF_P_ (.CLK( C), .D( D), .Q( Q));
    \sky130_fd_sc_hd__dfrtn_1 _DFF_NN0_ (.CLK_N( C), .D( D), .Q( Q), .RESET_B( R));
    unmapped dff cell: $_DFF_NN1_
    unmapped dff cell: $_DFF_NP0_
    unmapped dff cell: $_DFF_NP1_
    \sky130_fd_sc_hd__dfrtp_1 _DFF_PN0_ (.CLK( C), .D( D), .Q( Q), .RESET_B( R));
    \sky130_fd_sc_hd__dfstp_2 _DFF_PN1_ (.CLK( C), .D( D), .Q( Q), .SET_B( R));
    unmapped dff cell: $_DFF_PP0_
    unmapped dff cell: $_DFF_PP1_
    \sky130_fd_sc_hd__dfbbn_1 _DFFSR_NNN_ (.CLK_N( C), .D( D), .Q( Q), .Q_N(~Q), .RESET_B( R), .SET_B( S));
    unmapped dff cell: $_DFFSR_NNP_
    unmapped dff cell: $_DFFSR_NPN_
    unmapped dff cell: $_DFFSR_NPP_
    \sky130_fd_sc_hd__dfbbp_1 _DFFSR_PNN_ (.CLK( C), .D( D), .Q( Q), .Q_N(~Q), .RESET_B( R), .SET_B( S));
    unmapped dff cell: $_DFFSR_PNP_
    unmapped dff cell: $_DFFSR_PPN_
    unmapped dff cell: $_DFFSR_PPP_

4.1. Executing DFFLEGALIZE pass (convert FFs to types supported by the target).
Mapping DFF cells in module `\aes_core':
  mapped 129 $_DFF_PN0_ cells to \sky130_fd_sc_hd__dfrtp_1 cells.
Mapping DFF cells in module `\top':

5. Executing ABC pass (technology mapping using ABC).

5.1. Extracting gate netlist of module `\aes_core' to `<abc-temp-dir>/input.blif'..
Extracted 385 gates and 771 wires to a netlist network with 386 inputs and 257 outputs.

5.1.1. Executing ABC.
Running ABC command: "<yosys-exe-dir>/yosys-abc" -s -f <abc-temp-dir>/abc.script 2>&1
ABC: ABC command line: "source <abc-temp-dir>/abc.script".
ABC: 
ABC: + read_blif <abc-temp-dir>/input.blif 
ABC: + read_lib -w /home/divya/VLSI/sky130RTLDesignAndSynthesisWorkshop/lib/sky130_fd_sc_hd__tt_025C_1v80.lib 
ABC: Parsing finished successfully.  Parsing time =     0.11 sec
ABC: Scl_LibertyReadGenlib() skipped cell "sky130_fd_sc_hd__decap_12" without logic function.
ABC: Scl_LibertyReadGenlib() skipped cell "sky130_fd_sc_hd__decap_3" without logic function.
ABC: Scl_LibertyReadGenlib() skipped cell "sky130_fd_sc_hd__decap_4" without logic function.
ABC: Scl_LibertyReadGenlib() skipped cell "sky130_fd_sc_hd__decap_6" without logic function.
ABC: Scl_LibertyReadGenlib() skipped cell "sky130_fd_sc_hd__decap_8" without logic function.
ABC: Scl_LibertyReadGenlib() skipped sequential cell "sky130_fd_sc_hd__dfbbn_1".
ABC: Scl_LibertyReadGenlib() skipped sequential cell "sky130_fd_sc_hd__dfbbn_2".
ABC: Scl_LibertyReadGenlib() skipped sequential cell "sky130_fd_sc_hd__dfbbp_1".
ABC: Scl_LibertyReadGenlib() skipped sequential cell "sky130_fd_sc_hd__dfrbp_1".
ABC: Scl_LibertyReadGenlib() skipped sequential cell "sky130_fd_sc_hd__dfrbp_2".
ABC: Scl_LibertyReadGenlib() skipped sequential cell "sky130_fd_sc_hd__dfrtn_1".
ABC: Scl_LibertyReadGenlib() skipped sequential cell "sky130_fd_sc_hd__dfrtp_1".
ABC: Scl_LibertyReadGenlib() skipped sequential cell "sky130_fd_sc_hd__dfrtp_2".
ABC: Scl_LibertyReadGenlib() skipped sequential cell "sky130_fd_sc_hd__dfrtp_4".
ABC: Scl_LibertyReadGenlib() skipped sequential cell "sky130_fd_sc_hd__dfsbp_1".
ABC: Scl_LibertyReadGenlib() skipped sequential cell "sky130_fd_sc_hd__dfsbp_2".
ABC: Scl_LibertyReadGenlib() skipped sequential cell "sky130_fd_sc_hd__dfstp_1".
ABC: Scl_LibertyReadGenlib() skipped sequential cell "sky130_fd_sc_hd__dfstp_2".
ABC: Scl_LibertyReadGenlib() skipped sequential cell "sky130_fd_sc_hd__dfstp_4".
ABC: Scl_LibertyReadGenlib() skipped sequential cell "sky130_fd_sc_hd__dfxbp_1".
ABC: Scl_LibertyReadGenlib() skipped sequential cell "sky130_fd_sc_hd__dfxbp_2".
ABC: Scl_LibertyReadGenlib() skipped sequential cell "sky130_fd_sc_hd__dfxtp_1".
ABC: Scl_LibertyReadGenlib() skipped sequential cell "sky130_fd_sc_hd__dfxtp_2".
ABC: Scl_LibertyReadGenlib() skipped sequential cell "sky130_fd_sc_hd__dfxtp_4".
ABC: Scl_LibertyReadGenlib() skipped cell "sky130_fd_sc_hd__diode_2" without logic function.
ABC: Scl_LibertyReadGenlib() skipped cell "sky130_fd_sc_hd__dlclkp_1" without logic function.
ABC: Scl_LibertyReadGenlib() skipped cell "sky130_fd_sc_hd__dlclkp_2" without logic function.
ABC: Scl_LibertyReadGenlib() skipped cell "sky130_fd_sc_hd__dlclkp_4" without logic function.
ABC: Scl_LibertyReadGenlib() skipped sequential cell "sky130_fd_sc_hd__dlrbn_1".
ABC: Scl_LibertyReadGenlib() skipped sequential cell "sky130_fd_sc_hd__dlrbn_2".
ABC: Scl_LibertyReadGenlib() skipped sequential cell "sky130_fd_sc_hd__dlrbp_1".
ABC: Scl_LibertyReadGenlib() skipped sequential cell "sky130_fd_sc_hd__dlrbp_2".
ABC: Scl_LibertyReadGenlib() skipped sequential cell "sky130_fd_sc_hd__dlrtn_1".
ABC: Scl_LibertyReadGenlib() skipped sequential cell "sky130_fd_sc_hd__dlrtn_2".
ABC: Scl_LibertyReadGenlib() skipped sequential cell "sky130_fd_sc_hd__dlrtn_4".
ABC: Scl_LibertyReadGenlib() skipped sequential cell "sky130_fd_sc_hd__dlrtp_1".
ABC: Scl_LibertyReadGenlib() skipped sequential cell "sky130_fd_sc_hd__dlrtp_2".
ABC: Scl_LibertyReadGenlib() skipped sequential cell "sky130_fd_sc_hd__dlrtp_4".
ABC: Scl_LibertyReadGenlib() skipped sequential cell "sky130_fd_sc_hd__dlxbn_1".
ABC: Scl_LibertyReadGenlib() skipped sequential cell "sky130_fd_sc_hd__dlxbn_2".
ABC: Scl_LibertyReadGenlib() skipped sequential cell "sky130_fd_sc_hd__dlxbp_1".
ABC: Scl_LibertyReadGenlib() skipped sequential cell "sky130_fd_sc_hd__dlxtn_1".
ABC: Scl_LibertyReadGenlib() skipped sequential cell "sky130_fd_sc_hd__dlxtn_2".
ABC: Scl_LibertyReadGenlib() skipped sequential cell "sky130_fd_sc_hd__dlxtn_4".
ABC: Scl_LibertyReadGenlib() skipped sequential cell "sky130_fd_sc_hd__dlxtp_1".
ABC: Scl_LibertyReadGenlib() skipped three-state cell "sky130_fd_sc_hd__ebufn_1".
ABC: Scl_LibertyReadGenlib() skipped three-state cell "sky130_fd_sc_hd__ebufn_2".
ABC: Scl_LibertyReadGenlib() skipped three-state cell "sky130_fd_sc_hd__ebufn_4".
ABC: Scl_LibertyReadGenlib() skipped three-state cell "sky130_fd_sc_hd__ebufn_8".
ABC: Scl_LibertyReadGenlib() skipped sequential cell "sky130_fd_sc_hd__edfxbp_1".
ABC: Scl_LibertyReadGenlib() skipped sequential cell "sky130_fd_sc_hd__edfxtp_1".
ABC: Scl_LibertyReadGenlib() skipped three-state cell "sky130_fd_sc_hd__einvn_0".
ABC: Scl_LibertyReadGenlib() skipped three-state cell "sky130_fd_sc_hd__einvn_1".
ABC: Scl_LibertyReadGenlib() skipped three-state cell "sky130_fd_sc_hd__einvn_2".
ABC: Scl_LibertyReadGenlib() skipped three-state cell "sky130_fd_sc_hd__einvn_4".
ABC: Scl_LibertyReadGenlib() skipped three-state cell "sky130_fd_sc_hd__einvn_8".
ABC: Scl_LibertyReadGenlib() skipped three-state cell "sky130_fd_sc_hd__einvp_1".
ABC: Scl_LibertyReadGenlib() skipped three-state cell "sky130_fd_sc_hd__einvp_2".
ABC: Scl_LibertyReadGenlib() skipped three-state cell "sky130_fd_sc_hd__einvp_4".
ABC: Scl_LibertyReadGenlib() skipped three-state cell "sky130_fd_sc_hd__einvp_8".
ABC: Scl_LibertyReadGenlib() skipped cell "sky130_fd_sc_hd__lpflow_bleeder_1" without logic function.
ABC: Scl_LibertyReadGenlib() skipped cell "sky130_fd_sc_hd__lpflow_decapkapwr_12" without logic function.
ABC: Scl_LibertyReadGenlib() skipped cell "sky130_fd_sc_hd__lpflow_decapkapwr_3" without logic function.
ABC: Scl_LibertyReadGenlib() skipped cell "sky130_fd_sc_hd__lpflow_decapkapwr_4" without logic function.
ABC: Scl_LibertyReadGenlib() skipped cell "sky130_fd_sc_hd__lpflow_decapkapwr_6" without logic function.
ABC: Scl_LibertyReadGenlib() skipped cell "sky130_fd_sc_hd__lpflow_decapkapwr_8" without logic function.
ABC: Scl_LibertyReadGenlib() skipped sequential cell "sky130_fd_sc_hd__lpflow_inputisolatch_1".
ABC: Scl_LibertyReadGenlib() skipped sequential cell "sky130_fd_sc_hd__sdfbbn_1".
ABC: Scl_LibertyReadGenlib() skipped sequential cell "sky130_fd_sc_hd__sdfbbn_2".
ABC: Scl_LibertyReadGenlib() skipped sequential cell "sky130_fd_sc_hd__sdfbbp_1".
ABC: Scl_LibertyReadGenlib() skipped sequential cell "sky130_fd_sc_hd__sdfrbp_1".
ABC: Scl_LibertyReadGenlib() skipped sequential cell "sky130_fd_sc_hd__sdfrbp_2".
ABC: Scl_LibertyReadGenlib() skipped sequential cell "sky130_fd_sc_hd__sdfrtn_1".
ABC: Scl_LibertyReadGenlib() skipped sequential cell "sky130_fd_sc_hd__sdfrtp_1".
ABC: Scl_LibertyReadGenlib() skipped sequential cell "sky130_fd_sc_hd__sdfrtp_2".
ABC: Scl_LibertyReadGenlib() skipped sequential cell "sky130_fd_sc_hd__sdfrtp_4".
ABC: Scl_LibertyReadGenlib() skipped sequential cell "sky130_fd_sc_hd__sdfsbp_1".
ABC: Scl_LibertyReadGenlib() skipped sequential cell "sky130_fd_sc_hd__sdfsbp_2".
ABC: Scl_LibertyReadGenlib() skipped sequential cell "sky130_fd_sc_hd__sdfstp_1".
ABC: Scl_LibertyReadGenlib() skipped sequential cell "sky130_fd_sc_hd__sdfstp_2".
ABC: Scl_LibertyReadGenlib() skipped sequential cell "sky130_fd_sc_hd__sdfstp_4".
ABC: Scl_LibertyReadGenlib() skipped sequential cell "sky130_fd_sc_hd__sdfxbp_1".
ABC: Scl_LibertyReadGenlib() skipped sequential cell "sky130_fd_sc_hd__sdfxbp_2".
ABC: Scl_LibertyReadGenlib() skipped sequential cell "sky130_fd_sc_hd__sdfxtp_1".
ABC: Scl_LibertyReadGenlib() skipped sequential cell "sky130_fd_sc_hd__sdfxtp_2".
ABC: Scl_LibertyReadGenlib() skipped sequential cell "sky130_fd_sc_hd__sdfxtp_4".
ABC: Scl_LibertyReadGenlib() skipped cell "sky130_fd_sc_hd__sdlclkp_1" without logic function.
ABC: Scl_LibertyReadGenlib() skipped cell "sky130_fd_sc_hd__sdlclkp_2" without logic function.
ABC: Scl_LibertyReadGenlib() skipped cell "sky130_fd_sc_hd__sdlclkp_4" without logic function.
ABC: Scl_LibertyReadGenlib() skipped sequential cell "sky130_fd_sc_hd__sedfxbp_1".
ABC: Scl_LibertyReadGenlib() skipped sequential cell "sky130_fd_sc_hd__sedfxbp_2".
ABC: Scl_LibertyReadGenlib() skipped sequential cell "sky130_fd_sc_hd__sedfxtp_1".
ABC: Scl_LibertyReadGenlib() skipped sequential cell "sky130_fd_sc_hd__sedfxtp_2".
ABC: Scl_LibertyReadGenlib() skipped sequential cell "sky130_fd_sc_hd__sedfxtp_4".
ABC: Library "sky130_fd_sc_hd__tt_025C_1v80" from "/home/divya/VLSI/sky130RTLDesignAndSynthesisWorkshop/lib/sky130_fd_sc_hd__tt_025C_1v80.lib" has 324 cells (94 skipped: 63 seq; 13 tri-state; 18 no func; 0 dont_use).  Time =     0.19 sec
ABC: Memory =   19.52 MB. Time =     0.19 sec
ABC: Warning: Detected 9 multi-output gates (for example, "sky130_fd_sc_hd__fa_1").
ABC: + strash 
ABC: + &get -n 
ABC: + &fraig -x 
ABC: + &put 
ABC: + scorr 
ABC: Warning: The network is combinational (run "fraig" or "fraig_sweep").
ABC: + dc2 
ABC: + dretime 
ABC: + strash 
ABC: + &get -n 
ABC: + &dch -f 
ABC: + &nf 
ABC: + &put 
ABC: + write_blif <abc-temp-dir>/output.blif 

5.1.2. Re-integrating ABC results.
ABC RESULTS:   sky130_fd_sc_hd__xnor2_1 cells:      128
ABC RESULTS:   sky130_fd_sc_hd__nor2_1 cells:      128
ABC RESULTS:   sky130_fd_sc_hd__a21oi_1 cells:      128
ABC RESULTS:   sky130_fd_sc_hd__clkinv_1 cells:      129
ABC RESULTS:        internal signals:      128
ABC RESULTS:           input signals:      386
ABC RESULTS:          output signals:      257
Removing temp directory.

5.2. Extracting gate netlist of module `\top' to `<abc-temp-dir>/input.blif'..
Extracted 0 gates and 0 wires to a netlist network with 0 inputs and 0 outputs.
Don't call ABC as there is nothing to map.
Removing temp directory.

6. Executing Verilog backend.

6.1. Executing BMUXMAP pass.

6.2. Executing DEMUXMAP pass.
Dumping module `\aes_core'.
Dumping module `\top'.

7. Printing statistics.

=== aes_core ===

   Number of wires:               1291
   Number of wire bits:           1672
   Number of public wires:           7
   Number of public wire bits:     388
   Number of memories:               0
   Number of memory bits:            0
   Number of processes:              0
   Number of cells:                642
     sky130_fd_sc_hd__a21oi_1      128
     sky130_fd_sc_hd__clkinv_1     129
     sky130_fd_sc_hd__dfrtp_1      129
     sky130_fd_sc_hd__nor2_1       128
     sky130_fd_sc_hd__xnor2_1      128

=== top ===

   Number of wires:                  7
   Number of wire bits:            388
   Number of public wires:           7
   Number of public wire bits:     388
   Number of memories:               0
   Number of memory bits:            0
   Number of processes:              0
   Number of cells:                  1
     aes_core                        1

=== design hierarchy ===

   top                               1
     aes_core                        1

   Number of wires:               1298
   Number of wire bits:           2060
   Number of public wires:          14
   Number of public wire bits:     776
   Number of memories:               0
   Number of memory bits:            0
   Number of processes:              0
   Number of cells:                642
     sky130_fd_sc_hd__a21oi_1      128
     sky130_fd_sc_hd__clkinv_1     129
     sky130_fd_sc_hd__dfrtp_1      129
     sky130_fd_sc_hd__nor2_1       128
     sky130_fd_sc_hd__xnor2_1      128

Warnings: 26 unique messages, 234 total
End of script. Logfile hash: f7be4ca4c3, CPU: user 0.27s system 0.36s, MEM: 37.75 MB peak
Yosys 0.33 (git sha1 2584903a060)
Time spent: 49% 2x abc (0 sec), 27% 1x dfflibmap (0 sec), ...
